"Status","Start Time","Stop Time","Duration in ms","Parent Suite","Suite","Sub Suite","Test Class","Test Method","Name","Description"
"passed","Sat Jan 21 18:18:57 GMT 2023","Sat Jan 21 18:18:57 GMT 2023","1","","Tests","","Tests","lenWithinBorderSuccessfulTest","Title length within border Test",""
"passed","Sat Jan 21 18:18:57 GMT 2023","Sat Jan 21 18:18:57 GMT 2023","1","","Tests","","Tests","lenAboveBorderSuccessfulTest","Title length above upper border Test",""
"passed","Sat Jan 21 18:18:57 GMT 2023","Sat Jan 21 18:18:57 GMT 2023","49","","Tests","","Tests","anotherLanguageSuccessfulTest","Enter title on language which different from English Test",""
"passed","Sat Jan 21 18:18:57 GMT 2023","Sat Jan 21 18:18:57 GMT 2023","1","","Tests","","Tests","lenEqualBorderSuccessfulTest","Title length equal upper border Test",""
"passed","Sat Jan 21 18:18:57 GMT 2023","Sat Jan 21 18:18:57 GMT 2023","2","","Tests","","Tests","emptyStringUnSuccessfulTest","Empty title string Test",""
"passed","Sat Jan 21 18:18:57 GMT 2023","Sat Jan 21 18:18:57 GMT 2023","1","","Tests","","Tests","lenEqualBorderLastCharSpaceSuccessfulTest","Title length equal upper border and last character is space Test",""
"passed","Sat Jan 21 18:18:57 GMT 2023","Sat Jan 21 18:18:57 GMT 2023","1","","Tests","","Tests","nullStringUnSuccessfulTest","Title string is null Test",""
